{
  "version": "1.0",
  "fictional": true,
  "entities": [
    {
      "id": "bird",
      "kind": "physical_object",
      "label": "Blue Ceramic Bird",
      "aliases": [
        "Grandmother's blue bird"
      ]
    },
    {
      "id": "shelf",
      "kind": "composite",
      "label": "Hallway Memory Shelf",
      "aliases": [
        "memory display"
      ]
    },
    {
      "id": "collection",
      "kind": "collection",
      "label": "Annual Family Ornament Collection",
      "aliases": [
        "annual ornaments"
      ]
    },
    {
      "id": "bird-photo",
      "kind": "document",
      "label": "Apartment bird photograph",
      "aliases": [
        "1991 snapshot"
      ]
    },
    {
      "id": "label-observation",
      "kind": "observation",
      "label": "Bird manufacturing label observation",
      "aliases": [
        "underside inscription"
      ]
    },
    {
      "id": "account",
      "kind": "account",
      "label": "Elena bird interview transcript",
      "aliases": [
        "Elena recollection"
      ]
    },
    {
      "id": "stone",
      "kind": "physical_object",
      "label": "Smooth river stone",
      "aliases": [
        "lake pebble"
      ]
    },
    {
      "id": "lake-photo",
      "kind": "document",
      "label": "Calder lake photograph",
      "aliases": [
        "trip picture"
      ]
    },
    {
      "id": "ticket",
      "kind": "physical_object",
      "label": "Concert ticket",
      "aliases": [
        "2012 admission stub"
      ]
    },
    {
      "id": "letter",
      "kind": "document",
      "label": "Sealed handwritten letter",
      "aliases": [
        "sealed correspondence"
      ]
    },
    {
      "id": "ornament",
      "kind": "physical_object",
      "label": "2014 first-home ornament",
      "aliases": [
        "first house decoration"
      ]
    },
    {
      "id": "key",
      "kind": "physical_object",
      "label": "Small brass key",
      "aliases": [
        "cabinet key"
      ]
    },
    {
      "id": "elena",
      "kind": "person",
      "label": "Elena Marlow",
      "aliases": []
    },
    {
      "id": "ruth",
      "kind": "person",
      "label": "Ruth Marlow",
      "aliases": []
    },
    {
      "id": "leo",
      "kind": "person",
      "label": "Leo Marlow",
      "aliases": []
    },
    {
      "id": "maya",
      "kind": "person",
      "label": "Maya Calder",
      "aliases": []
    },
    {
      "id": "jonah",
      "kind": "person",
      "label": "Jonah Calder",
      "aliases": []
    },
    {
      "id": "eli",
      "kind": "person",
      "label": "Eli Hartwell",
      "aliases": []
    },
    {
      "id": "hallway",
      "kind": "place",
      "label": "Hallway",
      "aliases": []
    },
    {
      "id": "study",
      "kind": "place",
      "label": "Study",
      "aliases": []
    },
    {
      "id": "attic",
      "kind": "place",
      "label": "Attic",
      "aliases": []
    }
  ],
  "sources": [
    {
      "ref": "OBJ-0001/EVID-001",
      "path": "sources/OBJ-0001--EVID-001.txt",
      "derived_from": [],
      "entities": [
        "bird"
      ],
      "disclosure": "public"
    },
    {
      "ref": "OBJ-0001/EVID-002",
      "path": "sources/OBJ-0001--EVID-002.txt",
      "derived_from": [],
      "entities": [
        "bird"
      ],
      "disclosure": "public"
    },
    {
      "ref": "OBJ-0001/EVID-003",
      "path": "sources/OBJ-0001--EVID-003.txt",
      "derived_from": [
        "OBJ-0004/EVID-001"
      ],
      "entities": [
        "bird"
      ],
      "disclosure": "public"
    },
    {
      "ref": "OBJ-0001/EVID-004",
      "path": "sources/OBJ-0001--EVID-004.txt",
      "derived_from": [
        "OBJ-0001/EVID-003"
      ],
      "entities": [
        "bird"
      ],
      "disclosure": "public"
    },
    {
      "ref": "OBJ-0001/EVID-006",
      "path": "sources/OBJ-0001--EVID-006.txt",
      "derived_from": [],
      "entities": [
        "bird"
      ],
      "disclosure": "public"
    },
    {
      "ref": "OBJ-0001/EVID-007",
      "path": "sources/OBJ-0001--EVID-007.txt",
      "derived_from": [],
      "entities": [
        "bird"
      ],
      "disclosure": "public"
    },
    {
      "ref": "OBJ-0001/EVID-008",
      "path": "sources/OBJ-0001--EVID-008.txt",
      "derived_from": [],
      "entities": [
        "bird"
      ],
      "disclosure": "public"
    },
    {
      "ref": "OBJ-0001/EVID-009",
      "path": "sources/OBJ-0001--EVID-009.txt",
      "derived_from": [],
      "entities": [
        "bird"
      ],
      "disclosure": "public"
    },
    {
      "ref": "DISPLAY-0001/EVID-001",
      "path": "sources/DISPLAY-0001--EVID-001.txt",
      "derived_from": [],
      "entities": [
        "lake-photo",
        "shelf"
      ],
      "disclosure": "public"
    },
    {
      "ref": "DISPLAY-0001/EVID-002",
      "path": "sources/DISPLAY-0001--EVID-002.txt",
      "derived_from": [],
      "entities": [
        "shelf",
        "ticket"
      ],
      "disclosure": "public"
    },
    {
      "ref": "DISPLAY-0001/EVID-003",
      "path": "sources/DISPLAY-0001--EVID-003.txt",
      "derived_from": [],
      "entities": [
        "shelf"
      ],
      "disclosure": "public"
    },
    {
      "ref": "DISPLAY-0001/EVID-004",
      "path": "sources/DISPLAY-0001--EVID-004.txt",
      "derived_from": [],
      "entities": [
        "shelf"
      ],
      "disclosure": "acknowledge"
    },
    {
      "ref": "DISPLAY-0001/EVID-005",
      "path": "sources/DISPLAY-0001--EVID-005.txt",
      "derived_from": [
        "OBJ-0008/EVID-001"
      ],
      "entities": [
        "letter",
        "shelf"
      ],
      "disclosure": "public"
    },
    {
      "ref": "COLLECTION-0001/EVID-001",
      "path": "sources/COLLECTION-0001--EVID-001.txt",
      "derived_from": [],
      "entities": [
        "collection"
      ],
      "disclosure": "public"
    },
    {
      "ref": "COLLECTION-0001/EVID-002",
      "path": "sources/COLLECTION-0001--EVID-002.txt",
      "derived_from": [],
      "entities": [
        "collection"
      ],
      "disclosure": "public"
    },
    {
      "ref": "COLLECTION-0001/EVID-003",
      "path": "sources/COLLECTION-0001--EVID-003.txt",
      "derived_from": [],
      "entities": [
        "collection"
      ],
      "disclosure": "public"
    },
    {
      "ref": "COLLECTION-0001/EVID-004",
      "path": "sources/COLLECTION-0001--EVID-004.txt",
      "derived_from": [],
      "entities": [
        "collection"
      ],
      "disclosure": "public"
    },
    {
      "ref": "COLLECTION-0001/EVID-005",
      "path": "sources/COLLECTION-0001--EVID-005.txt",
      "derived_from": [],
      "entities": [
        "collection"
      ],
      "disclosure": "public"
    },
    {
      "ref": "OBJ-0002/EVID-001",
      "path": "sources/OBJ-0002--EVID-001.txt",
      "derived_from": [],
      "entities": [
        "bird-photo"
      ],
      "disclosure": "public"
    },
    {
      "ref": "OBJ-0002/EVID-002",
      "path": "sources/OBJ-0002--EVID-002.txt",
      "derived_from": [],
      "entities": [
        "bird-photo"
      ],
      "disclosure": "public"
    },
    {
      "ref": "OBJ-0003/EVID-001",
      "path": "sources/OBJ-0003--EVID-001.txt",
      "derived_from": [],
      "entities": [
        "label-observation"
      ],
      "disclosure": "public"
    },
    {
      "ref": "OBJ-0004/EVID-001",
      "path": "sources/OBJ-0004--EVID-001.txt",
      "derived_from": [],
      "entities": [
        "account",
        "bird"
      ],
      "disclosure": "public"
    },
    {
      "ref": "OBJ-0004/EVID-002",
      "path": "sources/OBJ-0004--EVID-002.txt",
      "derived_from": [],
      "entities": [
        "account",
        "bird"
      ],
      "disclosure": "public"
    },
    {
      "ref": "OBJ-0005/EVID-001",
      "path": "sources/OBJ-0005--EVID-001.txt",
      "derived_from": [],
      "entities": [
        "stone"
      ],
      "disclosure": "public"
    },
    {
      "ref": "OBJ-0005/EVID-002",
      "path": "sources/OBJ-0005--EVID-002.txt",
      "derived_from": [],
      "entities": [
        "stone"
      ],
      "disclosure": "public"
    },
    {
      "ref": "OBJ-0006/EVID-001",
      "path": "sources/OBJ-0006--EVID-001.txt",
      "derived_from": [],
      "entities": [
        "lake-photo"
      ],
      "disclosure": "public"
    },
    {
      "ref": "OBJ-0007/EVID-001",
      "path": "sources/OBJ-0007--EVID-001.txt",
      "derived_from": [],
      "entities": [
        "ticket"
      ],
      "disclosure": "public"
    },
    {
      "ref": "OBJ-0007/EVID-002",
      "path": "sources/OBJ-0007--EVID-002.txt",
      "derived_from": [],
      "entities": [
        "ticket"
      ],
      "disclosure": "public"
    },
    {
      "ref": "OBJ-0008/EVID-001",
      "path": "sources/OBJ-0008--EVID-001.txt",
      "derived_from": [],
      "entities": [
        "letter"
      ],
      "disclosure": "acknowledge"
    },
    {
      "ref": "OBJ-0009/EVID-001",
      "path": "sources/OBJ-0009--EVID-001.txt",
      "derived_from": [],
      "entities": [
        "ornament"
      ],
      "disclosure": "public"
    },
    {
      "ref": "OBJ-0010/EVID-001",
      "path": "sources/OBJ-0010--EVID-001.txt",
      "derived_from": [],
      "entities": [
        "key"
      ],
      "disclosure": "public"
    },
    {
      "ref": "OBJ-0010/EVID-002",
      "path": "sources/OBJ-0010--EVID-002.txt",
      "derived_from": [],
      "entities": [
        "key"
      ],
      "disclosure": "public"
    }
  ],
  "assertions": [
    {
      "ref": "OBJ-0001/CLM-001",
      "subject": "bird",
      "predicate": "possessed_by",
      "object": "Elena Marlow",
      "source_refs": [
        "OBJ-0001/EVID-001"
      ],
      "attributed_to": "Fictional curator",
      "basis": "observation",
      "recorded_at": "2026-07-20T12:00:00Z",
      "decision_ref": "SIM-OBJ-0001-CLM-001",
      "derived_from": [],